{
  "$schema": "https://json-schema.org/draft/2020-12/schema",
  "$id": "https://velvet.dev/schemas/velvet_rope/warrant.schema.json",
  "title": "Velvet Warrant",
  "type": "object",
  "additionalProperties": false,
  "required": [
    "warrant_id",
    "issued_at",
    "tenant_id",
    "environment",
    "request_hash",
    "policy_hash",
    "tool_schema_hash",
    "tool_name",
    "decision",
    "reason_codes",
    "obligations",
    "approval_required",
    "expires_at",
    "issuer"
  ],
  "properties": {
    "warrant_id": { "type": "string", "minLength": 1 },
    "issued_at": { "$ref": "#/$defs/timestamp" },
    "tenant_id": { "type": "string", "minLength": 1 },
    "environment": { "type": "string", "minLength": 1 },
    "request_hash": { "$ref": "#/$defs/hash" },
    "policy_hash": { "$ref": "#/$defs/hash" },
    "tool_schema_hash": { "$ref": "#/$defs/hash" },
    "tool_name": { "type": "string", "minLength": 1 },
    "decision": { "enum": ["execute", "block", "escalate"] },
    "reason_codes": {
      "type": "array",
      "minItems": 1,
      "items": { "type": "string", "minLength": 1 }
    },
    "obligations": {
      "type": "array",
      "items": { "type": "string", "minLength": 1 }
    },
    "approval_required": { "type": "boolean" },
    "expires_at": { "$ref": "#/$defs/timestamp" },
    "issuer": { "type": "string", "minLength": 1 },
    "reason": { "type": "string" },
    "tool_key": { "type": ["string", "null"], "minLength": 1 },
    "policy_statuses": {
      "type": "array",
      "items": { "type": "string" }
    },
    "policy_reasons": {
      "type": "array",
      "items": { "type": "string" }
    },
    "jurisdiction_evidence": {
      "type": "array",
      "items": { "type": "object", "additionalProperties": true }
    },
    "risk_class": { "type": ["string", "null"] },
    "pricing_status": { "type": "string" },
    "seal_id": { "type": ["string", "null"], "minLength": 1 },
    "bound_seal_id": { "type": ["string", "null"], "minLength": 1 },
    "thread_id": { "type": ["string", "null"], "minLength": 1 },
    "product_surface": { "type": "string" },
    "actor_user_id": { "type": ["string", "null"] },
    "agent_id": { "type": ["string", "null"] },
    "session_id": { "type": ["string", "null"] },
    "request_id": { "type": ["string", "null"] },
    "action_type": { "type": "string" },
    "mcp_server": { "type": ["string", "null"] },
    "mcp_tool": { "type": ["string", "null"] },
    "data_class": { "type": ["string", "null"] },
    "policy_version": { "type": ["string", "null"] },
    "arguments_hash": { "anyOf": [{ "$ref": "#/$defs/hash" }, { "type": "null" }] },
    "approval_request_id": { "type": ["string", "null"] },
    "ledger_record_hash": { "anyOf": [{ "$ref": "#/$defs/hash" }, { "type": "null" }] },
    "selected": { "type": ["boolean", "null"] },
    "clears_rope": { "type": ["boolean", "null"] },
    "expected_upside": { "type": ["number", "null"] },
    "surprisal": { "type": ["number", "null"] },
    "confidence": { "type": ["number", "null"] },
    "entry_price": { "type": ["number", "null"] },
    "final_lambda": { "type": ["number", "null"] },
    "clearance_score": { "type": ["number", "null"] },
    "cost_penalty": { "type": ["number", "null"] },
    "risk_penalty": { "type": ["number", "null"] },
    "scarcity_pressure": { "type": ["number", "null"] },
    "certificate": { "type": ["object", "null"], "additionalProperties": true },
    "warrant_hash": { "$ref": "#/$defs/hash" },
    "signature": { "type": ["object", "string", "null"], "additionalProperties": true },
    "key_id": { "type": ["string", "null"] },
    "signature_algorithm": { "type": ["string", "null"] },
    "signing_key_id": { "type": ["string", "null"] },
    "signing_provider": { "type": ["string", "null"] },
    "signing_algorithm": { "type": ["string", "null"] },
    "signing_key_version": { "type": ["string", "null"] }
  },
  "$defs": {
    "hash": {
      "type": "string",
      "pattern": "^sha256:[0-9a-f]{64}$"
    },
    "timestamp": {
      "type": "string",
      "pattern": "^\\d{4}-\\d{2}-\\d{2}T\\d{2}:\\d{2}:\\d{2}(?:\\.\\d{3,9})?Z$"
    }
  }
}
